{
  "patient": {
    "firstName": "Cason",
    "lastName": "Wright",
    "subscriberId": "710875473",
    "dateOfBirth": "03/29/2016",
    "name": "CASON WRIGHT",
    "relationship": "Subscriber",
    "dob": "03/29/2016",
    "gender": "M",
    "primaryAddress": "3201 KARI LN APT 1011, GREENVILLE, TX 75402",
    "workPhone": "(903) 441-6494",
    "faxNumber": "-",
    "primaryHomePhone": "(903) 441-6494",
    "plan": "TX Medicaid Child (Under 21)",
    "issuedId": "710875473",
    "eligibilityStatus": "Member is eligible: \n                        Smiley Tooth LLLP - \n                        Jennifer Chou -\n                        The Smiley Tooth - 3018 Ridge Rd\nSte 120 - ROCKWALL -\n                        09/27/2025"
  },
  "extractionDate": "2025-09-27T20:08:54.354Z",
  "portal": "DentaQuest",
  "serviceHistory": [
    {
      "date": "08/07/2025",
      "code": "D2930",
      "description": "prefabricated stainless steel crown - primary tooth",
      "toothSurface": "B/\n\t\t\t      \t\t\t\t\t\tUR/\n\t\t\t      \t\t\t\t\t\tUA/\n\t\t\t      \t\t\t\t\t\t-",
      "placeOfService": "Office"
    },
    {
      "date": "08/07/2025",
      "code": "D1510",
      "description": "space maintainer-fixed, unilateral- per quadrant",
      "toothSurface": "LR/\n\t\t\t      \t\t\t\t\t\tLR/\n\t\t\t      \t\t\t\t\t\tLA/\n\t\t\t      \t\t\t\t\t\t-",
      "placeOfService": "Office"
    },
    {
      "date": "08/07/2025",
      "code": "D1351",
      "description": "sealant - per tooth",
      "toothSurface": "3/\n\t\t\t      \t\t\t\t\t\tUR/\n\t\t\t      \t\t\t\t\t\tUA/\n\t\t\t      \t\t\t\t\t\tOL",
      "placeOfService": "Office"
    },
    {
      "date": "08/07/2025",
      "code": "D2930",
      "description": "prefabricated stainless steel crown - primary tooth",
      "toothSurface": "A/\n\t\t\t      \t\t\t\t\t\tUR/\n\t\t\t      \t\t\t\t\t\tUA/\n\t\t\t      \t\t\t\t\t\t-",
      "placeOfService": "Office"
    },
    {
      "date": "08/07/2025",
      "code": "D7140",
      "description": "extraction, erupted tooth or exposed root (elevation and/or forceps removal)",
      "toothSurface": "C/\n\t\t\t      \t\t\t\t\t\tUR/\n\t\t\t      \t\t\t\t\t\tUA/\n\t\t\t      \t\t\t\t\t\t-",
      "placeOfService": "Office"
    },
    {
      "date": "08/07/2025",
      "code": "D1351",
      "description": "sealant - per tooth",
      "toothSurface": "30/\n\t\t\t      \t\t\t\t\t\tLR/\n\t\t\t      \t\t\t\t\t\tLA/\n\t\t\t      \t\t\t\t\t\tOB",
      "placeOfService": "Office"
    },
    {
      "date": "08/07/2025",
      "code": "D7140",
      "description": "extraction, erupted tooth or exposed root (elevation and/or forceps removal)",
      "toothSurface": "S/\n\t\t\t      \t\t\t\t\t\tLR/\n\t\t\t      \t\t\t\t\t\tLA/\n\t\t\t      \t\t\t\t\t\t-",
      "placeOfService": "Office"
    },
    {
      "date": "08/07/2025",
      "code": "D2930",
      "description": "prefabricated stainless steel crown - primary tooth",
      "toothSurface": "T/\n\t\t\t      \t\t\t\t\t\tLR/\n\t\t\t      \t\t\t\t\t\tLA/\n\t\t\t      \t\t\t\t\t\t-",
      "placeOfService": "Office"
    },
    {
      "date": "08/07/2025",
      "code": "D9230",
      "description": "inhalation of nitrous oxide/analgesia, anxiolysis",
      "toothSurface": "-/-/-/-",
      "placeOfService": "Office"
    },
    {
      "date": "08/07/2025",
      "code": "D1330",
      "description": "oral hygiene instructions",
      "toothSurface": "-/-/-/-",
      "placeOfService": "Office"
    },
    {
      "date": "08/07/2025",
      "code": "D2930",
      "description": "prefabricated stainless steel crown - primary tooth",
      "toothSurface": "B/\n\t\t\t      \t\t\t\t\t\tUR/\n\t\t\t      \t\t\t\t\t\tUA/\n\t\t\t      \t\t\t\t\t\t-",
      "placeOfService": "Office"
    },
    {
      "date": "08/07/2025",
      "code": "D1510",
      "description": "space maintainer-fixed, unilateral- per quadrant",
      "toothSurface": "LR/\n\t\t\t      \t\t\t\t\t\tLR/\n\t\t\t      \t\t\t\t\t\tLA/\n\t\t\t      \t\t\t\t\t\t-",
      "placeOfService": "Office"
    },
    {
      "date": "08/07/2025",
      "code": "D1351",
      "description": "sealant - per tooth",
      "toothSurface": "3/\n\t\t\t      \t\t\t\t\t\tUR/\n\t\t\t      \t\t\t\t\t\tUA/\n\t\t\t      \t\t\t\t\t\tOL",
      "placeOfService": "Office"
    },
    {
      "date": "08/07/2025",
      "code": "D2930",
      "description": "prefabricated stainless steel crown - primary tooth",
      "toothSurface": "A/\n\t\t\t      \t\t\t\t\t\tUR/\n\t\t\t      \t\t\t\t\t\tUA/\n\t\t\t      \t\t\t\t\t\t-",
      "placeOfService": "Office"
    },
    {
      "date": "08/07/2025",
      "code": "D7140",
      "description": "extraction, erupted tooth or exposed root (elevation and/or forceps removal)",
      "toothSurface": "C/\n\t\t\t      \t\t\t\t\t\tUR/\n\t\t\t      \t\t\t\t\t\tUA/\n\t\t\t      \t\t\t\t\t\t-",
      "placeOfService": "Office"
    },
    {
      "date": "08/07/2025",
      "code": "D1351",
      "description": "sealant - per tooth",
      "toothSurface": "30/\n\t\t\t      \t\t\t\t\t\tLR/\n\t\t\t      \t\t\t\t\t\tLA/\n\t\t\t      \t\t\t\t\t\tOB",
      "placeOfService": "Office"
    },
    {
      "date": "08/07/2025",
      "code": "D7140",
      "description": "extraction, erupted tooth or exposed root (elevation and/or forceps removal)",
      "toothSurface": "S/\n\t\t\t      \t\t\t\t\t\tLR/\n\t\t\t      \t\t\t\t\t\tLA/\n\t\t\t      \t\t\t\t\t\t-",
      "placeOfService": "Office"
    },
    {
      "date": "08/07/2025",
      "code": "D2930",
      "description": "prefabricated stainless steel crown - primary tooth",
      "toothSurface": "T/\n\t\t\t      \t\t\t\t\t\tLR/\n\t\t\t      \t\t\t\t\t\tLA/\n\t\t\t      \t\t\t\t\t\t-",
      "placeOfService": "Office"
    },
    {
      "date": "08/07/2025",
      "code": "D9230",
      "description": "inhalation of nitrous oxide/analgesia, anxiolysis",
      "toothSurface": "-/-/-/-",
      "placeOfService": "Office"
    },
    {
      "date": "08/07/2025",
      "code": "D1330",
      "description": "oral hygiene instructions",
      "toothSurface": "-/-/-/-",
      "placeOfService": "Office"
    },
    {
      "date": "06/12/2025",
      "code": "D0220",
      "description": "intraoral - periapical first radiographic image",
      "toothSurface": "8/\n\t\t\t      \t\t\t\t\t\t-/-/-",
      "placeOfService": "Office"
    },
    {
      "date": "06/12/2025",
      "code": "D1206",
      "description": "topical application of fluoride varnish",
      "toothSurface": "-/-/-/-",
      "placeOfService": "Office"
    },
    {
      "date": "06/12/2025",
      "code": "D1120",
      "description": "prophylaxis - child",
      "toothSurface": "-/-/-/-",
      "placeOfService": "Office"
    },
    {
      "date": "06/12/2025",
      "code": "D0272",
      "description": "bitewings - two radiographic images",
      "toothSurface": "-/-/-/-",
      "placeOfService": "Office"
    },
    {
      "date": "06/12/2025",
      "code": "D0230",
      "description": "intraoral - periapical each additional radiographic image",
      "toothSurface": "24/\n\t\t\t      \t\t\t\t\t\t-/-/-",
      "placeOfService": "Office"
    },
    {
      "date": "06/12/2025",
      "code": "D0603",
      "description": "Caries risk assessment and documentation, with a finding of high risk",
      "toothSurface": "-/-/-/-",
      "placeOfService": "Office"
    },
    {
      "date": "06/12/2025",
      "code": "D0230",
      "description": "intraoral - periapical each additional radiographic image",
      "toothSurface": "10/\n\t\t\t      \t\t\t\t\t\t-/-/-",
      "placeOfService": "Office"
    },
    {
      "date": "06/12/2025",
      "code": "D0120",
      "description": "periodic oral evaluation - established patient",
      "toothSurface": "-/-/-/-",
      "placeOfService": "Office"
    },
    {
      "date": "03/13/2019",
      "code": "D0603",
      "description": "Caries risk assessment and documentation, with a finding of high risk",
      "toothSurface": "-/-/-/-",
      "placeOfService": "Office"
    },
    {
      "date": "03/13/2019",
      "code": "D0145",
      "description": "oral evaluation for a patient under three years of age and counseling with primary caregiver",
      "toothSurface": "-/-/-/-",
      "placeOfService": "Office"
    }
  ],
  "eligibilityHistory": [
    {
      "Benefit Plan": "TX HHSC Medicaid Dental Services",
      "Member Number": "710875473",
      "Client Name": "TX Medicaid Child (Under 21)",
      "Client Number": "7003042001",
      "Benefit Effective Date": "05/01/2025",
      "Termination Date": ""
    }
  ],
  "claims": [
    {
      "number": "202523039516900",
      "serviceDate": "08/07/2025",
      "provider": "Lopez, Velina",
      "location": "3018 Ridge RdROCKWALL",
      "status": "Finalized",
      "billed": 894.81,
      "paid": 857.95
    },
    {
      "number": "202516530011900",
      "serviceDate": "06/12/2025",
      "provider": "Lopez, Velina",
      "location": "3018 Ridge RdROCKWALL",
      "status": "Finalized",
      "billed": 150.06,
      "paid": 143.4
    }
  ],
  "claimsDetails": [
    {
      "claimNumber": "202523039516900",
      "memberName": "CASON WRIGHT",
      "memberDOB": "3/29/2016",
      "memberNumber": "710875473",
      "plan": "TX Med Child",
      "provider": "Velina Lopez (NPI# 1932770682)",
      "serviceLocation": "The Smiley Tooth 3018 Ridge Rd, ROCKWALL, TX 75032",
      "business": "Smiley Tooth LLLP (NPI# 1740685957)",
      "placeOfService": "Office",
      "officeReferenceNumber": "CGAAGBQ1T",
      "totalBilled": 894.81,
      "totalPatientPay": 0,
      "payment": 857.95,
      "paymentDate": "8/22/2025",
      "checkETFNumber": "3232216126",
      "receivedDate": "8/18/2025",
      "finalDecisionDate": "8/19/2025",
      "notes": "NEA#378099726",
      "services": [
        {
          "date": "08/07/2025",
          "procedureCode": "D9230",
          "paidProcedureCode": "D9230",
          "tooth": "//-/",